{
  "schema_version": "datapan.operation-assertion-policies.v1",
  "policy_set": {
    "id": "datapan-health-canary-assertions",
    "version": 1,
    "supersedes": null
  },
  "generated_at": "2026-07-14T10:05:00Z",
  "authority": "datapan-registry",
  "diagnostic_vocabulary": {
    "schema_version": "datapan.diagnostic-cause-action-vocabulary.v1",
    "path": "policy/diagnostic-cause-action-vocabulary.v1.json",
    "sha256": "aa03c42960a59725b829b934ad07548dacb8f149c7a920a35a9e32c0459b49fc"
  },
  "bindings": {
    "registry": {
      "path": "data/data-go-kr.registry.json",
      "sha256": "0520d0db0d9ee07b7cbccce0c08439d0b02be901bf10e8491187d96e59d7a0d0"
    },
    "health_probe_catalog": {
      "path": "reports/health-probe-catalog.json",
      "sha256": "827433dec514fa10ebef780ff611f6314b6e1d7270acde81ce6d60ec7a46e27e"
    }
  },
  "artifact_sha256": "cc5a88aafbddc76d3bf2b66f4f38efaf5a6341555dbf79dadb243233df01bba4",
  "operations": [
    {
      "operation_id": "dpr-op-00000001",
      "operation_revision_sha256": "23609debca35ce3b447b5da7e6b56a0cbe00bc8df9c59d12a4c4db2c1d120ef1",
      "dimensions": {
        "transport": {
          "state": "not_asserted",
          "reason_code": "provider_transport_expectation_not_reviewed",
          "evidence": null
        },
        "contract": {
          "state": "asserted",
          "assertion_type": "declared_response_field_vocabulary",
          "projection_input": "normalized_leaf_field_names",
          "declared_response_fields": [
            "dutyAddr",
            "dutyDay1",
            "dutyDay10",
            "dutyDay2",
            "dutyDay3",
            "dutyDay4",
            "dutyDay5",
            "dutyDay6",
            "dutyDay7",
            "dutyDay8",
            "dutyDay9",
            "dutyDayEtc",
            "dutyDaytime1",
            "dutyDaytime10",
            "dutyDaytime2",
            "dutyDaytime3",
            "dutyDaytime4",
            "dutyDaytime5",
            "dutyDaytime6",
            "dutyDaytime7",
            "dutyDaytime8",
            "dutyDaytime9",
            "dutyDiv",
            "dutyDivNam",
            "dutyName",
            "dutyTel1",
            "hpid",
            "numOfRows",
            "pageNo",
            "resultCode",
            "resultMsg",
            "rnum",
            "totalCount"
          ],
          "unknown_field_policy": "fail",
          "empty_payload_policy": "not_observed",
          "evidence": {
            "kind": "registry_operation_contract",
            "rationale_code": "registry_declares_normalized_response_field_vocabulary",
            "path": "data/data-go-kr.registry.json",
            "sha256": "0520d0db0d9ee07b7cbccce0c08439d0b02be901bf10e8491187d96e59d7a0d0",
            "selector": {
              "dataset_id": "15000480",
              "operation_name": "명절 비상진료기관 FullData 내려받기목록정보 조회",
              "upstream_operation_seq": "17442"
            }
          }
        },
        "presence": {
          "state": "not_asserted",
          "reason_code": "record_presence_expectation_not_reviewed",
          "evidence": null
        },
        "semantic": {
          "state": "not_asserted",
          "reason_code": "domain_semantics_not_reviewed",
          "evidence": null
        },
        "freshness": {
          "state": "not_asserted",
          "reason_code": "upstream_timestamp_contract_not_reviewed",
          "evidence": null
        }
      }
    },
    {
      "operation_id": "dpr-op-00000002",
      "operation_revision_sha256": "a821cab3fff959a5677c4b3eb0740e42d6b8effd12e9606c6d738c080dff1042",
      "dimensions": {
        "transport": {
          "state": "not_asserted",
          "reason_code": "provider_transport_expectation_not_reviewed",
          "evidence": null
        },
        "contract": {
          "state": "asserted",
          "assertion_type": "declared_response_field_vocabulary",
          "projection_input": "normalized_leaf_field_names",
          "declared_response_fields": [
            "num",
            "numOfRows",
            "pageNo",
            "resultCode",
            "resultMsg",
            "sgId",
            "sgName",
            "sgTypecode",
            "sgVotedate",
            "totalCount"
          ],
          "unknown_field_policy": "fail",
          "empty_payload_policy": "not_observed",
          "evidence": {
            "kind": "registry_operation_contract",
            "rationale_code": "registry_declares_normalized_response_field_vocabulary",
            "path": "data/data-go-kr.registry.json",
            "sha256": "0520d0db0d9ee07b7cbccce0c08439d0b02be901bf10e8491187d96e59d7a0d0",
            "selector": {
              "dataset_id": "15000897",
              "operation_name": "선거코드",
              "upstream_operation_seq": "20139"
            }
          }
        },
        "presence": {
          "state": "not_asserted",
          "reason_code": "record_presence_expectation_not_reviewed",
          "evidence": null
        },
        "semantic": {
          "state": "not_asserted",
          "reason_code": "domain_semantics_not_reviewed",
          "evidence": null
        },
        "freshness": {
          "state": "not_asserted",
          "reason_code": "upstream_timestamp_contract_not_reviewed",
          "evidence": null
        }
      }
    },
    {
      "operation_id": "dpr-op-00000003",
      "operation_revision_sha256": "c3ad5d55a1fb6d4f9f99fcfcb862d9c0d9974b0b56ba0267343aa2a0684f9668",
      "dimensions": {
        "transport": {
          "state": "not_asserted",
          "reason_code": "provider_transport_expectation_not_reviewed",
          "evidence": null
        },
        "contract": {
          "state": "asserted",
          "assertion_type": "declared_response_field_vocabulary",
          "projection_input": "normalized_leaf_field_names",
          "declared_response_fields": [
            "clCd",
            "clCdNm",
            "numOfRows",
            "pageNo",
            "resultCode",
            "resultMsg",
            "totalCount"
          ],
          "unknown_field_policy": "fail",
          "empty_payload_policy": "not_observed",
          "evidence": {
            "kind": "registry_operation_contract",
            "rationale_code": "registry_declares_normalized_response_field_vocabulary",
            "path": "data/data-go-kr.registry.json",
            "sha256": "0520d0db0d9ee07b7cbccce0c08439d0b02be901bf10e8491187d96e59d7a0d0",
            "selector": {
              "dataset_id": "15001697",
              "operation_name": "의료기관종별코드조회",
              "upstream_operation_seq": "24807"
            }
          }
        },
        "presence": {
          "state": "not_asserted",
          "reason_code": "record_presence_expectation_not_reviewed",
          "evidence": null
        },
        "semantic": {
          "state": "not_asserted",
          "reason_code": "domain_semantics_not_reviewed",
          "evidence": null
        },
        "freshness": {
          "state": "not_asserted",
          "reason_code": "upstream_timestamp_contract_not_reviewed",
          "evidence": null
        }
      }
    },
    {
      "operation_id": "dpr-op-00000004",
      "operation_revision_sha256": "94cce505893000df96770be74f71b7f20738641aa83a845340f00daa3c811a47",
      "dimensions": {
        "transport": {
          "state": "not_asserted",
          "reason_code": "provider_transport_expectation_not_reviewed",
          "evidence": null
        },
        "contract": {
          "state": "asserted",
          "assertion_type": "declared_response_field_vocabulary",
          "projection_input": "normalized_leaf_field_names",
          "declared_response_fields": [
            "estbDe",
            "fcltNm",
            "homepageAddr",
            "numOfRows",
            "pageNo",
            "resultCode",
            "resultMsg",
            "rprsNm",
            "sggNm",
            "sidoNm",
            "svcCd",
            "svcNm",
            "totalCount"
          ],
          "unknown_field_policy": "fail",
          "empty_payload_policy": "not_observed",
          "evidence": {
            "kind": "registry_operation_contract",
            "rationale_code": "registry_declares_normalized_response_field_vocabulary",
            "path": "data/data-go-kr.registry.json",
            "sha256": "0520d0db0d9ee07b7cbccce0c08439d0b02be901bf10e8491187d96e59d7a0d0",
            "selector": {
              "dataset_id": "15001839",
              "operation_name": "민간 자원별 제공서비스 정보 조회",
              "upstream_operation_seq": "26193"
            }
          }
        },
        "presence": {
          "state": "not_asserted",
          "reason_code": "record_presence_expectation_not_reviewed",
          "evidence": null
        },
        "semantic": {
          "state": "not_asserted",
          "reason_code": "domain_semantics_not_reviewed",
          "evidence": null
        },
        "freshness": {
          "state": "not_asserted",
          "reason_code": "upstream_timestamp_contract_not_reviewed",
          "evidence": null
        }
      }
    },
    {
      "operation_id": "dpr-op-00000005",
      "operation_revision_sha256": "151b836e075558d191d21cb6be520850a99e2f645c90efb8f4805e9951429e86",
      "dimensions": {
        "transport": {
          "state": "not_asserted",
          "reason_code": "provider_transport_expectation_not_reviewed",
          "evidence": null
        },
        "contract": {
          "state": "asserted",
          "assertion_type": "declared_response_field_vocabulary",
          "projection_input": "normalized_leaf_field_names",
          "declared_response_fields": [
            "body",
            "header"
          ],
          "unknown_field_policy": "fail",
          "empty_payload_policy": "not_observed",
          "evidence": {
            "kind": "registry_operation_contract",